<?xml version="1.0" encoding="UTF-8"?>
<?xml-stylesheet type="text/css" href="style.css"?> <!-- Link to external CSS stylesheet -->
<!DOCTYPE students SYSTEM "student.dtd"> <!-- Link to external DTD file -->
<!-- The 'students' element is the root element of the XML document -->
<students>
  <!-- Each student element represents an individual student -->
  <student>
    <!-- The 'name' element contains attributes for the student's name -->
    <name firstName="Gordon" lastName="Sumner" preferredName="Sting"/>
    <!-- The 'contactInformation' element contains attributes for the student's contact information -->
    <contactInformation email="sting@thepolice.com" phone="212.123.4567"/>
    <!-- The 'academicInformation' element contains attributes for the student's academic information -->
    <academicInformation status="full-time" year="first" GPA="4.0" advisor="Andy Summers" studentID="1234567"/>
    <!-- The 'degreeInformation' element contains attributes for the student's degree information -->
    <degreeInformation major="Music" minor="English" initialEnrollment="1969-08-25" graduationDate="1973-05-01"/>
  </student>

  <student>
    <name firstName = "Kim" lastName = "Thayil"/>
    <contactInformation email = "kim@soundgarden.com" phone = "206.123.4567"/>
    <academicInformation status = "full-time" year = "second" GPA = "3.0" advisor = "Chris Cornell" studentID = "4567890"/>
    <degreeInformation major = "Music" minor = "Philosophy" initialEnrollment = "1983-08-25" graduationDate = "1987-05-01"/>
  </student>

  <student>
    <name firstName="Saul" lastName="Hudson" preferredName="Slash"/>
    <contactInformation email="slash@gnr.com" phone="213.456.8392"/>
    <academicInformation status="part-time" year="fourth" GPA="2.0" advisor="Axl Rose" studentID="8302438"/>
    <degreeInformation major="Music" minor="Criminal Justice" initialEnrollment="1983-08-25" graduationDate="1987-05-01"/>
  </student>

  <student>
    <name firstName="Emily" lastName="Kokal"/>
    <contactInformation email="emily@warpaint.com" phone="213.123.7654"/>
    <academicInformation status="full-time" year="third" GPA="3.8" advisor="Jenny Lee Lindberg" studentID="2983928"/>
    <degreeInformation major="Political Science" minor="Law" initialEnrollment="1998-08-25" graduationDate="2002-05-01"/>
  </student>

  <student>
    <name firstName="Mike" lastName="Inez"/>
    <contactInformation email="mike@aic.com" phone="213.444.3323"/>
    <academicInformation status="full-time" year="second" GPA="4.0" advisor="Jerry Cantrell" studentID="7645726"/>
    <degreeInformation major="Business Management" minor="Math" initialEnrollment="1984-08-25" graduationDate="1988-05-01"/>
  </student>
</students>
